{
  "$schema": "https://lumicorp.github.io/ruhroh/schemas/benchmark-summary-v1.schema.json",
  "version": "ruhroh_benchmark_summary_v1",
  "createdAt": "2026-07-08T12:00:00.000Z",
  "claimVersion": "ruhroh_benchmark_claim_v1",
  "tool": {
    "name": "@kestrel-agents/ruhroh",
    "version": "0.6.0-beta.0"
  },
  "source": {
    "resultsPath": "./sample-results",
    "suitePath": "./ruhroh/suites/ruhroh-sample/suite.json",
    "suiteSha256": "77d974f71e63ae7bf435f9796a8c7a8dbc282f6bbaa2fd673502791c62b190fc",
    "runPlanPath": "./ruhroh-run-plan.json",
    "runPlanSha256": "f51a0b70f78b792eda39a5b6ef6a3717c6eaa474e7e909eaea126fdb972e437c",
    "htmlPath": "./ruhroh-publication/ruhroh-compare.html",
    "benchmarkClaimPath": "./benchmark-claim.json",
    "benchmarkSummaryPath": "./benchmark-summary.json",
    "resultArtifacts": [
      {
        "path": "./sample-results/run-one/ruhroh-loop-result.json",
        "sha256": "19aafd3de86aea748b915e7bbdffcba7ef769873a843baca2a960c6cd195a568",
        "scenarioId": "simple-newsletter",
        "adapter": "docs-fixture-native-stack",
        "runId": "sample-newsletter-agent-a-1",
        "sampleId": "simple-newsletter/agent-a/1-of-2",
        "scenarioVersion": "1.0.0",
        "benchmarkTarget": {
          "targetId": "docs-fixture-native-stack",
          "stream": "native-stack",
          "adapterId": "agent-a",
          "harness": {
            "name": "fixture-newsletter",
            "version": "docs-sample-v1"
          },
          "requestedModel": {
            "provider": "docs",
            "model": "sample-agent",
            "canonicalId": "docs/sample-agent",
            "version": "2026-07-08",
            "protocol": "fixture-command",
            "promptVersion": "docs-v1"
          },
          "actualModel": {
            "provider": "docs",
            "model": "sample-agent",
            "canonicalId": "docs/sample-agent",
            "version": "2026-07-08",
            "protocol": "fixture-command",
            "promptVersion": "docs-v1"
          },
          "providerPath": {
            "provider": "docs",
            "protocol": "fixture-command"
          },
          "recommendedStack": {
            "recommended": true,
            "rationale": "Docs sample uses the maintained fixture adapter with its native fixture model."
          }
        },
        "artifactInventory": [
          {
            "name": "evalInput",
            "path": "./sample-results/run-one/ruhroh-loop-eval-input.json",
            "available": true,
            "sizeBytes": 122,
            "sha256": "3763a8caaa6ef3a89cdbc9aab8335e5aab51837d717e007ac6bdb83676239c1e"
          },
          {
            "name": "evalResult",
            "path": "./sample-results/run-one/ruhroh-loop-eval.json",
            "available": true,
            "sizeBytes": 2465,
            "sha256": "076c551c4114b48d017aebf98480d339dc92b72ca3a4fb164a2f4074fc6eea93"
          },
          {
            "name": "events",
            "path": "./sample-results/run-one/events.jsonl",
            "available": true,
            "sizeBytes": 57,
            "sha256": "354f962620ba81e40eee8813d3ad33cddbd01e7c40f9bf10166f843d7f7c7060"
          },
          {
            "name": "eventsTarball",
            "path": "./sample-results/run-one/ruhroh-loop-events.tar.gz",
            "available": true,
            "sizeBytes": 53,
            "sha256": "2002b38a24ad7ff391d9b87433e1df4e852ebc937edf13e5bd95b44798e8b1e5"
          },
          {
            "name": "implementationRuns",
            "path": "./sample-results/run-one/ruhroh-loop-iterations.jsonl",
            "available": true,
            "sizeBytes": 403,
            "sha256": "791fecab95e947282d21a5293f8b1a127310161277ac9efba6c50bc7d257d867"
          },
          {
            "name": "journey",
            "path": "./sample-results/run-one/ruhroh-loop-journey.json",
            "available": true,
            "sizeBytes": 179,
            "sha256": "cd414b655de7de51f329079a8f9f8caaf6f4b417b2e99180e43acefa61d2e2f2"
          },
          {
            "name": "result",
            "path": "./sample-results/run-one/ruhroh-loop-result.json",
            "available": true,
            "sizeBytes": 8393,
            "sha256": "19aafd3de86aea748b915e7bbdffcba7ef769873a843baca2a960c6cd195a568"
          },
          {
            "name": "runManifest",
            "path": "./sample-results/run-one/ruhroh-run-manifest.json",
            "available": true,
            "sizeBytes": 2883,
            "sha256": "ddb29446d073b45540bb387b8bd8d751938580e5cdacce6f4c82ca692492eedc"
          },
          {
            "name": "transcript",
            "path": "./sample-results/run-one/transcript.log",
            "available": true,
            "sizeBytes": 69,
            "sha256": "b64339f315ee62b69bca610f6689b7ba7e5172c6b15147fbed0ad2c28f02139a"
          },
          {
            "name": "transcriptsTarball",
            "path": "./sample-results/run-one/ruhroh-loop-transcripts.tar.gz",
            "available": true,
            "sizeBytes": 58,
            "sha256": "454c0113d5058433b39a1ae789695420ce3cf42c8706ddc22778b671e55a8146"
          },
          {
            "name": "workspaceSummary",
            "path": "./sample-results/run-one/ruhroh-workspace-summary.json",
            "available": true,
            "sizeBytes": 674,
            "sha256": "c5bcf5f724511667836f9a56cf409403be4e939d114d69265a4c395295f6cb29"
          },
          {
            "name": "workspaceTarball",
            "path": "./sample-results/run-one/ruhroh-workspace.tar.gz",
            "available": true,
            "sizeBytes": 57,
            "sha256": "3c3f9efb11335aa9ef5106a20811c02a379548e6f7c7cedb4ccede370c2a1ca8"
          }
        ],
        "sizeBytes": 8393
      },
      {
        "path": "./sample-results/run-two/ruhroh-loop-result.json",
        "sha256": "db0fd51fa1f598a701be9d2fee78c1f21a63b5ef6b6319a48c01a7fefced4bb0",
        "scenarioId": "simple-newsletter",
        "adapter": "docs-fixture-native-stack",
        "runId": "sample-newsletter-agent-a-2",
        "sampleId": "simple-newsletter/agent-a/2-of-2",
        "scenarioVersion": "1.0.0",
        "benchmarkTarget": {
          "targetId": "docs-fixture-native-stack",
          "stream": "native-stack",
          "adapterId": "agent-a",
          "harness": {
            "name": "fixture-newsletter",
            "version": "docs-sample-v1"
          },
          "requestedModel": {
            "provider": "docs",
            "model": "sample-agent",
            "canonicalId": "docs/sample-agent",
            "version": "2026-07-08",
            "protocol": "fixture-command",
            "promptVersion": "docs-v1"
          },
          "actualModel": {
            "provider": "docs",
            "model": "sample-agent",
            "canonicalId": "docs/sample-agent",
            "version": "2026-07-08",
            "protocol": "fixture-command",
            "promptVersion": "docs-v1"
          },
          "providerPath": {
            "provider": "docs",
            "protocol": "fixture-command"
          },
          "recommendedStack": {
            "recommended": true,
            "rationale": "Docs sample uses the maintained fixture adapter with its native fixture model."
          }
        },
        "artifactInventory": [
          {
            "name": "evalInput",
            "path": "./sample-results/run-two/ruhroh-loop-eval-input.json",
            "available": true,
            "sizeBytes": 122,
            "sha256": "3763a8caaa6ef3a89cdbc9aab8335e5aab51837d717e007ac6bdb83676239c1e"
          },
          {
            "name": "evalResult",
            "path": "./sample-results/run-two/ruhroh-loop-eval.json",
            "available": true,
            "sizeBytes": 2645,
            "sha256": "d319f036ff5f3331b31819d61f5f182b4bf8943e542523e9962b847a906e9fa8"
          },
          {
            "name": "events",
            "path": "./sample-results/run-two/events.jsonl",
            "available": true,
            "sizeBytes": 57,
            "sha256": "c866b4a17696f13dbce7e7b63e649de021acbf7e9cd6a55e26b3c44240de8fc9"
          },
          {
            "name": "eventsTarball",
            "path": "./sample-results/run-two/ruhroh-loop-events.tar.gz",
            "available": true,
            "sizeBytes": 53,
            "sha256": "3f5e5b3c5e59edbefa9782469149a61fc6eb18b9eebdff1f990b614013b24f37"
          },
          {
            "name": "implementationRuns",
            "path": "./sample-results/run-two/ruhroh-loop-iterations.jsonl",
            "available": true,
            "sizeBytes": 409,
            "sha256": "3d9b3814142e91963857753f9de32e03cac88db3d54ce487446ffda00b8cfd15"
          },
          {
            "name": "journey",
            "path": "./sample-results/run-two/ruhroh-loop-journey.json",
            "available": true,
            "sizeBytes": 179,
            "sha256": "ede885c0cdce22f1b632cf6ac4d2b46beaedb1a1aa745ef8b622dcc667094609"
          },
          {
            "name": "result",
            "path": "./sample-results/run-two/ruhroh-loop-result.json",
            "available": true,
            "sizeBytes": 8598,
            "sha256": "db0fd51fa1f598a701be9d2fee78c1f21a63b5ef6b6319a48c01a7fefced4bb0"
          },
          {
            "name": "runManifest",
            "path": "./sample-results/run-two/ruhroh-run-manifest.json",
            "available": true,
            "sizeBytes": 2883,
            "sha256": "42c07b94425dd558bf6ffe6f6f99ade0a59868f72c0df9a502966b5633ce86df"
          },
          {
            "name": "transcript",
            "path": "./sample-results/run-two/transcript.log",
            "available": true,
            "sizeBytes": 69,
            "sha256": "fc147d4635e80448bfd305b3aec71b5f0514de1c27b64057ab044fd3b03d3ed0"
          },
          {
            "name": "transcriptsTarball",